Input,Output
"What was my total spending last month?","Your total spending last month was $XXXX."
"Can you analyze my spending habits?","Based on your spending, you are spending a lot on XXXX category. Consider reducing it."
"How much did I spend on groceries last week?","Your spending on groceries last week was $XXXX."
"Can you provide a breakdown of my expenses by category?","Here is a breakdown of your expenses: Groceries - $XXXX, Dining - $XXXX, Transportation - $XXXX."
"What is my average monthly spending on entertainment?","Your average monthly spending on entertainment is $XXXX."
"Compare my spending on utilities between this month and last month.","Your spending on utilities has increased by $XXXX compared to last month."
"Can you suggest ways to reduce my transportation expenses?","Consider carpooling or using public transportation to reduce your transportation expenses."
"Predict my total expenses for the next month based on current trends.","Based on current trends, your total expenses for next month are estimated to be $XXXX."
"Show me a graph of my expenses over the past six months.","[Graph visualization showing expenses over the past six months]."
"Provide a summary of my largest expenses this year.","Your largest expenses this year were in the categories of XXXX and XXXX, totaling $XXXX."
"Can you alert me if I exceed my budget for dining this month?","You are close to exceeding your budget for dining this month. Be mindful of your spending."
"What percentage of my income am I spending on rent?","You are spending XX% of your income on rent."
"Which category accounts for the highest portion of my expenses?","XXXX category accounts for the highest portion of your expenses."
"Can you recommend budgeting strategies to save money on groceries?","Consider meal planning, buying in bulk, and using coupons to save money on groceries."
"Provide a detailed breakdown of my expenses for the past quarter.","Here is a detailed breakdown of your expenses for the past quarter: XXXX - $XXXX, XXXX - $XXXX, XXXX - $XXXX."
"Compare my spending on entertainment between this year and last year.","Your spending on entertainment has increased/decreased by $XXXX compared to last year."
"Alert me if my spending on miscellaneous items exceeds $100 in a week.","You have exceeded your spending limit on miscellaneous items this week."
"Can you analyze my spending pattern for the past six months?","Your spending pattern for the past six months shows a consistent increase in XXXX category."
"Provide a summary of my transportation expenses for the current month.","Your transportation expenses for the current month total $XXXX."
"Can you predict my annual expenses based on my current budget?","Based on your current budget, your estimated annual expenses are $XXXX."
"Calculate the average monthly spending on dining for the past year.","Your average monthly spending on dining for the past year was $XXXX."
"Show me a breakdown of my expenses by day for the current week.","Here is a breakdown of your expenses by day for the current week: Monday - $XXXX, Tuesday - $XXXX, Wednesday - $XXXX, ..."
"Recommend ways to save money on utilities.","Consider using energy-efficient appliances and adjusting your thermostat to save money on utilities."
"Provide a summary of my largest expenses for the past three months.","Your largest expenses for the past three months were in the categories of XXXX and XXXX, totaling $XXXX."
"Can you alert me if my spending on shopping exceeds $200 in a day?","You have exceeded your spending limit on shopping today."
"Analyze my spending trends for the past year and suggest areas for improvement.","Your spending trends for the past year indicate overspending in XXXX category. Consider reducing expenses in this area."
"Show a breakdown of my expenses by category for the current month.","Here is a breakdown of your expenses by category for the current month: Groceries - $XXXX, Dining - $XXXX, Transportation - $XXXX."
"Estimate my total expenses for the upcoming holiday season based on historical data.","Based on historical data, your total expenses for the upcoming holiday season are estimated to be $XXXX."
"Can you alert me if my total expenses exceed $1000 in a week?","You are close to exceeding your total expense limit for this week."
"Calculate my total spending on utilities for the past six months.","Your total spending on utilities for the past six months was $XXXX."
"Can you suggest ways to reduce my overall expenses?","Consider creating a budget, tracking expenses, and avoiding impulse purchases to reduce overall expenses."
"Provide insights into my spending behavior based on recent transactions.","Your recent transactions show increased spending in XXXX category. Consider reviewing your budget."
"Analyze my spending on dining and suggest ways to cut costs.","Your spending on dining is higher than average. Consider cooking at home more often to cut costs."
"Alert me if my total expenses for this month exceed my budget.","You are close to exceeding your budget for this month. Monitor your expenses to stay within budget."
"Show a summary of my expenses by category for the past year.","Here is a summary of your expenses by category for the past year: Groceries - $XXXX, Dining - $XXXX, Transportation - $XXXX."
"Can you provide a trend analysis of my expenses for the past six months?","Your expenses have been gradually increasing/decreasing over the past six months."
"Calculate the percentage of my income spent on rent and utilities combined.","You are spending XX% of your income on rent and utilities combined."
"Analyze my spending on entertainment and suggest budget-friendly alternatives.","Consider exploring free or low-cost entertainment options to reduce spending in this category."
"Provide a breakdown of my expenses by category for the past quarter.","Here is a breakdown of your expenses by category for the past quarter: Groceries - $XXXX, Dining - $XXXX, Transportation - $XXXX."
"Can you alert me if my spending on dining exceeds $300 in a week?","You have exceeded your spending limit on dining this week."
"Calculate my total spending on transportation for the past year.","Your total spending on transportation for the past year was $XXXX."
"Estimate my total expenses for the next month based on recent trends.","Based on recent trends, your total expenses for next month are estimated to be $XXXX."
"Analyze my spending patterns and recommend areas for cost-cutting.","Based on your spending patterns, consider reducing expenses in XXXX category to save money."
"Can you provide a summary of my largest expenses for the past six months?","Your largest expenses for the past six months were in the categories of XXXX and XXXX, totaling $XXXX."
"Compare my spending on utilities between this year and last year.","Your spending on utilities has increased/decreased by $XXXX compared to last year."
"Alert me if my spending on miscellaneous items exceeds $50 in a day.","You have exceeded your spending limit on miscellaneous items today."
"Analyze my spending pattern for the past six months and provide insights.","Your spending pattern for the past six months shows increased spending in XXXX category. Consider adjusting your budget."
